{
  "candidateModelCommitSha": "f98a2638efc0ca44f3d67f9625d751f1cc0a9337",
  "candidateModelVersion": null,
  "completedAt": "2026-09-28T00:07:16Z",
  "eligibilityStatus": "ELIGIBLE_LEVEL_2",
  "limitationReasons": [
    "EFFECTIVE_CONFIG_PARTIAL",
    "SETTLEMENT_CLV_UNAVAILABLE: POSTGAME_SNAPSHOT_NOT_LINKED_TO_THIS_PREGAME_RUN"
  ],
  "manifestHash": "2d2d58ef33370deda8a5d8d3f5244595838a53fa4509c71f5084602a37c336f2",
  "performance": null,
  "pricingVersions": {
    "F5_ML": "f5_three_way_v1"
  },
  "productionModelCommitSha": "bdb897e102bb7bc0e9265e5ea96a2db01fb83374",
  "productionRunId": "2026-09-27T16:43:44Z",
  "provenance": {
    "capturedAt": "2026-09-28T00:07:16Z",
    "ingestedAt": "2026-09-28T00:07:16Z",
    "sourceFile": null,
    "sourceKey": null,
    "sourceSystem": "replay_engine"
  },
  "replayFidelity": "LEVEL_2_PRODUCTION_EQUIVALENT",
  "replayFrameworkVersion": "2",
  "replayMode": "CANDIDATE_MODEL",
  "replayRunId": "839cf030db99797dd4a7b6c40f3218012feaba96",
  "runStatus": "COMPLETED",
  "schemaVersion": "1",
  "snapshotDate": "2026-09-27",
  "snapshotId": "b0c7f92d119526d4c401e56927caaaa2eeed8a9a",
  "snapshotManifestHash": "7327e31c7ec480538fe9f346cc32c91e9a232a4cdee9f29c29cf939a6cf7e546",
  "startedAt": "2026-09-28T00:07:16Z",
  "summary": {
    "clvResolved": 0,
    "decisionsChanged": 0,
    "marketsComparable": 117,
    "marketsEvaluated": 165,
    "settledResolved": 0,
    "settledUnresolved": 165
  },
  "workflowRunId": "36360663154"
}