{
  "candidateModelCommitSha": "cdf8cd32fb356fa53dc2a0b5b2b8b39e2b1dafda",
  "candidateModelVersion": null,
  "completedAt": "2026-10-08T01:29:29Z",
  "eligibilityStatus": "ELIGIBLE_LEVEL_2",
  "limitationReasons": [
    "EFFECTIVE_CONFIG_PARTIAL",
    "SETTLEMENT_CLV_UNAVAILABLE: POSTGAME_SNAPSHOT_NOT_LINKED_TO_THIS_PREGAME_RUN"
  ],
  "manifestHash": "f5067fddd5bb88d58995240b3585ad5dce691741a3d73d6c7defa9a1e58e9bfb",
  "performance": null,
  "pricingVersions": {
    "F5_ML": "f5_three_way_v1"
  },
  "productionModelCommitSha": "9deb3c989c65c350887f07cb46ca9c241bcdda7a",
  "productionRunId": "2026-10-07T21:48:25Z",
  "provenance": {
    "capturedAt": "2026-10-08T01:29:29Z",
    "ingestedAt": "2026-10-08T01:29:29Z",
    "sourceFile": null,
    "sourceKey": null,
    "sourceSystem": "replay_engine"
  },
  "replayFidelity": "LEVEL_2_PRODUCTION_EQUIVALENT",
  "replayFrameworkVersion": "2",
  "replayMode": "CANDIDATE_MODEL",
  "replayRunId": "9c8350d7e9f8af72e0c5be7731c08848a42e1e2f",
  "runStatus": "COMPLETED",
  "schemaVersion": "1",
  "snapshotDate": "2026-10-07",
  "snapshotId": "8cd96858c953260168212ca3ffd8bf250480bbb7",
  "snapshotManifestHash": "ce309947926d9eda6d828c021e068f96a999c6554b0bcd003bfad9eec38b5745",
  "startedAt": "2026-10-08T01:29:29Z",
  "summary": {
    "clvResolved": 0,
    "decisionsChanged": 0,
    "marketsComparable": 34,
    "marketsEvaluated": 44,
    "settledResolved": 0,
    "settledUnresolved": 44
  },
  "workflowRunId": "37712557363"
}