{
  "candidateModelCommitSha": "58cfcbe9b12c72eb3bf936b714081983bae4f7be",
  "candidateModelVersion": null,
  "completedAt": "2026-08-03T00:41:38Z",
  "eligibilityStatus": "ELIGIBLE_LEVEL_2",
  "limitationReasons": [
    "EFFECTIVE_CONFIG_PARTIAL",
    "PRODUCTION_COMMIT_UNKNOWN"
  ],
  "manifestHash": "28fa49b5c0b1ac5aa94f4b1cdd452afbeec45fc6ce5051fe02b468223cbb2118",
  "performance": null,
  "pricingVersions": {
    "F5_ML": "f5_three_way_v1"
  },
  "productionModelCommitSha": null,
  "productionRunId": "2026-08-01T22:10:49Z",
  "provenance": {
    "capturedAt": "2026-08-03T00:41:38Z",
    "ingestedAt": "2026-08-03T00:41:38Z",
    "sourceFile": null,
    "sourceKey": null,
    "sourceSystem": "replay_engine"
  },
  "replayFidelity": "LEVEL_2_PRODUCTION_EQUIVALENT",
  "replayFrameworkVersion": "2",
  "replayMode": "CANDIDATE_MODEL",
  "replayRunId": "aeea2949975ed113107cf8f58df4862d7ed01f7f",
  "runStatus": "COMPLETED",
  "schemaVersion": "1",
  "snapshotDate": "2026-08-01",
  "snapshotId": "ffaca16713b55fcdd41565d3ab758f7ed97e5f24",
  "snapshotManifestHash": "63c2bd6270613bc8eb83117bc38e79c3b6072baf150c318789a5990884aa8542",
  "startedAt": "2026-08-03T00:41:38Z",
  "summary": {
    "clvResolved": 45,
    "decisionsChanged": 24,
    "marketsComparable": 119,
    "marketsEvaluated": 165,
    "settledResolved": 0,
    "settledUnresolved": 165
  },
  "workflowRunId": null
}