{
  "candidateModelCommitSha": "bb56a82730c1a810f071ccd04b85746fd647339c",
  "candidateModelVersion": null,
  "completedAt": "2026-09-30T23:38:25Z",
  "eligibilityStatus": "ELIGIBLE_LEVEL_2",
  "limitationReasons": [
    "EFFECTIVE_CONFIG_PARTIAL",
    "SETTLEMENT_CLV_UNAVAILABLE: POSTGAME_SNAPSHOT_NOT_LINKED_TO_THIS_PREGAME_RUN"
  ],
  "manifestHash": "c6b790f45630d74ec6ce1773b616e87c55076c2bf44579034d4f6f0c26897800",
  "performance": null,
  "pricingVersions": {
    "F5_ML": "f5_three_way_v1"
  },
  "productionModelCommitSha": "af76d4615aaee582cc9bdec7209c3a5a35e62169",
  "productionRunId": "2026-09-30T20:41:44Z",
  "provenance": {
    "capturedAt": "2026-09-30T23:38:25Z",
    "ingestedAt": "2026-09-30T23:38:25Z",
    "sourceFile": null,
    "sourceKey": null,
    "sourceSystem": "replay_engine"
  },
  "replayFidelity": "LEVEL_2_PRODUCTION_EQUIVALENT",
  "replayFrameworkVersion": "2",
  "replayMode": "CANDIDATE_MODEL",
  "replayRunId": "2b2d9c29e60e3e1bdc2a5472a2ea8250c097ebd9",
  "runStatus": "COMPLETED",
  "schemaVersion": "1",
  "snapshotDate": "2026-09-30",
  "snapshotId": "45f1b99679b6268414275f3a1746ecd4d9d7a4d3",
  "snapshotManifestHash": "537219c0b58b608e552c237fbebc365f55f382462fc5d9a600e0290d17f5f356",
  "startedAt": "2026-09-30T23:38:25Z",
  "summary": {
    "clvResolved": 0,
    "decisionsChanged": 4,
    "marketsComparable": 32,
    "marketsEvaluated": 44,
    "settledResolved": 0,
    "settledUnresolved": 44
  },
  "workflowRunId": "36791597980"
}