{
  "candidateModelCommitSha": "76419f7a29c1b462aad7c2794e8d85062631ff40",
  "candidateModelVersion": null,
  "completedAt": "2026-09-25T23:15:29Z",
  "eligibilityStatus": "ELIGIBLE_LEVEL_2",
  "limitationReasons": [
    "EFFECTIVE_CONFIG_PARTIAL",
    "SETTLEMENT_CLV_UNAVAILABLE: POSTGAME_SNAPSHOT_NOT_LINKED_TO_THIS_PREGAME_RUN"
  ],
  "manifestHash": "047107887e13d518742e06fa2828581572ddbee2f912665392da287efe0474b1",
  "performance": null,
  "pricingVersions": {
    "F5_ML": "f5_three_way_v1"
  },
  "productionModelCommitSha": "83bb07e6f45b005daaca52a0385ac790f48a3f30",
  "productionRunId": "2026-09-25T21:53:59Z",
  "provenance": {
    "capturedAt": "2026-09-25T23:15:29Z",
    "ingestedAt": "2026-09-25T23:15:29Z",
    "sourceFile": null,
    "sourceKey": null,
    "sourceSystem": "replay_engine"
  },
  "replayFidelity": "LEVEL_2_PRODUCTION_EQUIVALENT",
  "replayFrameworkVersion": "2",
  "replayMode": "CANDIDATE_MODEL",
  "replayRunId": "e86bc7c8b5ee5b8bf941e65cae3923ba84b6f357",
  "runStatus": "COMPLETED",
  "schemaVersion": "1",
  "snapshotDate": "2026-09-25",
  "snapshotId": "80cdf6fb6fed2a2bdbd716e0f31bbd619bb7fea7",
  "snapshotManifestHash": "328b18f73dcacd68e4d7c0d88ba53160eb1377cf5323a45f63f7e910b551a36d",
  "startedAt": "2026-09-25T23:15:29Z",
  "summary": {
    "clvResolved": 0,
    "decisionsChanged": 0,
    "marketsComparable": 112,
    "marketsEvaluated": 187,
    "settledResolved": 0,
    "settledUnresolved": 187
  },
  "workflowRunId": "36199871214"
}